你这直上直下的走势真恶心,324,0,08-23 09:54
A股这是卖公司给外资啊,391,0,08-23 09:47
美股获最长牛市，转头看看大A，心里莫名的烦恼和悲怆,305,0,08-23 08:48
不懂就不要到处乱说，吓人,318,0,08-23 08:27
中国股市散户还需你们保护，幼稚，你从事券商，最终目,432,0,08-23 07:28
都是些神经病在喝酒吃药,495,0,08-23 00:22
今天的地量比股灾时还低了，为4年来最低值，说明到底,1234,1,08-22 16:15
没有亮丽的50，己经没有存在的必要了,309,0,08-22 14:52
2451.8,303,0,08-22 14:46
这样老套路怎可把市场人气激活？应全面开花，由其中证,343,0,08-22 14:39
没有50假意护盘，面子看不下去了,362,0,08-22 14:28
傻逼50,367,0,08-22 14:28
人心的摧残太厉害，虽然指数跌得少！,269,0,08-22 14:17
50指数不拉红，估计就是死给你看的节奏了,616,0,08-22 14:13
我想知道明天还会拉吗？没有用的？人心倒了！,294,0,08-22 14:09
公家队又开始耍宝,338,0,08-22 13:55
跌又跌不死～吓唬我,325,0,08-22 13:54
勾比队，别护盘了！,295,0,08-22 13:53
怎么看大A，都像三毛流浪记那本连环画。,221,0,08-22 13:51
不好，50指数撑不住了,286,0,08-22 13:50
还能稳住么[为什么],294,0,08-22 13:49
为什么删我的帖子，举报一些坏人以免我们这些小散上当,333,0,08-22 13:46
这是怎么做到股票跌指数却不跌的？,682,2,08-22 13:44
上证真恶心！！！,193,0,08-22 13:42
50居然还想蠢蠢欲动，真的没救了，明天8月23日，不怪,1461,3,08-22 12:53
大盘都跌0.5了，50还死撑着不跌,243,0,08-22 11:29
我觉得会有新高，概率大,332,0,08-22 11:25
个股大面积普跌，热点退潮，50死扛，人心惶惶，救救小,287,0,08-22 11:20
大A算不算试验田？,157,0,08-22 11:18
我来猜测50跌到那里才有价值投资1900,292,0,08-22 11:17
2个上证50是什么意思呀。,1523,0,08-22 11:17
举而不坚，不如不举。,213,0,08-22 11:09
再拉呀，长个300点酒超过上证拉,345,0,08-22 10:39
又开始拉50了，牛币的不要不要的,569,1,08-22 10:32
Ａ股有点澳门的感觉，有一点像拉斯维加斯！,477,1,08-22 10:30
下半年新的牛市也许就从这一波开始，50必创新高,316,0,08-22 10:13
垃圾，才涨了一点就开始跌了,452,0,08-22 09:54
上证50就这样，无耻不要脸惯了，大家习惯就好了,239,0,08-22 09:53
涨2天跌20天？不能这样无耻啊？趁热打铁调一下继续恢,300,0,08-22 09:49
怎么不继续拉，我们在看表演呢,328,0,08-22 09:32
砖家们吹嘘是哪个阶段？散户认为哪个阶段？,238,0,08-22 09:02
为什么要举个例子给大家看，业绩不佳机构扎堆，中国股,418,0,08-22 07:54
证券黑嘴多得是，什么价值投资，业绩亏损也要投，所以,273,0,08-22 07:50
银座600858真正的市净率，实际PB不足0.1倍! 割肉银座,283,0,08-22 06:32
美股将创历史最长牛市！美国股民真特木幸福，中国股民,233,0,08-21 22:19
报团的白马股累积太高的风险，想让散户来接盘是不可能,1123,3,08-21 20:12
股票好不好，有没有参与有时候要看看换手率，高才叫活,898,0,08-21 19:02
头肩顶,355,0,08-21 18:47
调控出效果万科怎么不暴跌呀，万科股票很坚挺就是操纵,293,0,08-21 18:37
这几年抱团操纵白马股的风险在哪里，就是因为机构筹码,711,0,08-21 16:55
新华微评：莫让高房租阻断“安居梦”  来源:大智慧 08,480,0,08-21 16:46
沪指收复2700点，短线关注超跌品种,259,0,08-21 16:18
我敢打赌明天必大涨,1540,4,08-21 15:58
50是大盘的中流砥柱，创业板中小板是大盘的风险点,305,0,08-21 15:17
上证50只争朝夕，不久可上一万点,259,0,08-21 14:28
今天建仓能挣5个点吗？,778,1,08-21 14:14
不要做接盘侠，散户明智哦，很多人跑去买美股了，让散,265,0,08-21 14:05
热烈欢迎有实力的资金进入603803 瑞斯康达！二市唯一,273,0,08-21 14:00
什么是周期，还不到时候！,387,0,08-21 13:59
美股最长牛市要来了！还差2天美股本轮牛市达到3453天 ,323,0,08-21 13:58
关于2638！关于守株待兔！ 说一个农民耕作闲间坐在大,3261,8,08-21 13:54
住建部约谈房价上涨城市 调控强化地方房价问责制 下 ,980,1,08-21 13:34
50这条毒蛇还没死之前千万不能进场,283,0,08-21 13:30
决心已下，上一次刚买入就遇上gjd出货，吸取教训这次,322,0,08-21 13:28
50又给散户朋友发糖吃，记吃不记打的禁不住诱惑该买入,326,0,08-21 13:23
市场底是什么？就是白马股要补跌，上证50补跌，机构拉,397,0,08-21 13:15
市场底是什么？就是白马股要不跌，机构拉白酒了，看来,203,0,08-21 13:13
装啥比呢，下午跳水,565,1,08-21 13:06
以1敌8继续[空仓][空仓][空仓][空仓]除上证50指数没有,321,0,08-21 12:02
中国股市机构操纵一流还能炒股吗？市场都泛滥好多年，,432,0,08-21 11:16
无耻,315,0,08-21 11:00
数字经济/多地发布工业投资计划 着力发展战略性新兴产,373,0,08-21 10:53
广东省房地产工作电视电话会议召开，坚决遏制房价上涨,284,0,08-21 10:44
50快拉！,282,0,08-21 10:38
永辉超市2批次明虾检出违禁兽药 新华网 百家号08-21 0,688,0,08-21 10:37
拉50是昨天开会定的吗,601,1,08-21 10:37
住建部约谈房价上涨城市 调控强化地方房价问责制 上 ,357,0,08-21 10:33
炒房也是犯罪/司法手段进入房地产市场，这类炒房将是,290,0,08-21 10:28
房地产信托贷款收紧 陕西宁波等地暂停所有地产项目 凤,594,0,08-21 10:25
叶檀：房产税之前 逃命的机会还有两年 08-15 21:35727,734,0,08-21 10:16
不要。脸，,197,0,08-21 10:10
不要脸,627,1,08-21 10:10
害人精！这才是真正的害人精,311,0,08-21 09:56
真无耻,327,0,08-21 09:52
利空 按租售同权的政策来理解，对房地产来讲就是利空,581,0,08-21 07:41
这也是头肩顶！,449,1,08-20 21:35
A股在底部的反复洗盘，已经让无数人损失惨重,957,1,08-20 20:08
新加坡50夜盘开始砸了,497,0,08-20 19:56
场内期权,290,0,08-20 19:37
要反转了信吗？,289,0,08-20 17:22
多地暂停新增地产信托报备 上周已接到窗口指导 目前银,378,0,08-20 15:18
如果有天50跌了，上证大涨那才是真涨啊,389,0,08-20 15:16
股票配资平台深圳股票配资公司：市场在犹豫中下跌，在,1242,0,08-20 14:51
今天好险，都绿了，又来起来了[鼓掌][鼓掌][胜利][胜,190,0,08-20 14:45
继续拉，看收盘怎么死的,248,0,08-20 14:36
今天是傻逼村长指示拉的吧！,674,1,08-20 14:29
茅台没腰斩低不就不会出现,279,0,08-20 14:24
股市该这样搞:1，新股的发行上市，首日取消涨跌限制，,1217,2,08-20 14:19
又拉金融,321,0,08-20 14:11
2018年8月29日有待验证，全志科技业绩高于科大讯飞，,540,0,08-20 14:04
阿斗啊阿斗,603,1,08-20 13:58
50指数至少还有70点,263,0,08-20 13:51
今天再跌，大家都不玩了！国家队出一把手吧！,149,0,08-20 13:51
直接把50拉涨停板吧！只有这一个绝招儿了！,263,0,08-20 13:48
你抗不住了吧！,259,0,08-20 13:46
时代变了，散户不跟,329,0,08-20 13:38
要护盘请拉升尔康医药,305,0,08-20 13:37
崩盘的趋势了,285,0,08-20 13:24
本身就是一坨屎,182,0,08-20 13:21
这货居然红了,131,0,08-20 13:18
亚太普涨，牛[赞][赞][赞],264,0,08-20 13:11
上证50都拉不起大盘了[大笑],322,0,08-20 11:55
50牛啊，指数居然还红的,139,0,08-20 11:46
北京住建部等多部门重锤“房租暴涨”网友却表示：并不,673,0,08-20 11:27
又快3000只股票下跌了，混乱的市场太可怕了！,314,0,08-20 11:15
[为什么]强颜欢笑,355,1,08-20 12:29
开始砸盘去创新低了，2638万岁！,433,1,08-20 11:30
上证50脸红这么难看？打鸡血了啊,340,0,08-20 11:27
那点脸就别护着了，有跟没有一个样，都是软……,472,0,08-20 11:19
傻逼 拉券商 银行 保险 两桶油不好使了，你拉韭菜都会,511,0,08-20 11:17
备受关注的湖北“房屋中介涉黑案”一审宣判，以任氏兄,1482,0,08-20 11:12
中国股市就是被这个假的50指数害惨了！,346,0,08-20 11:09
看到一点希望,371,0,08-20 11:03
金融股票本周触摸5周线和5月线，下周和下月主跌开始,206,0,08-20 10:49
你为什么要涨啊！我的又要跌了！？\,368,1,08-20 10:44
顶住！别怂！世界都在看着！,800,3,08-20 10:41
南京11部门联合整治房地产市场秩序维护群众合法权益 ,276,0,08-20 10:38
苏州九部门联合发文：开展规范房地产市场秩序专项行动,273,0,08-20 10:37
你跌，我的才会涨！,279,0,08-20 10:02
不是好东西，人人看你跌！,347,0,08-20 10:01
快快直下[不赞],209,0,08-20 10:01
底是走出来才被承认的东西,221,0,08-20 09:51
9省16市发文治理房地产市场乱象：打击炒房黑中介 新浪,921,0,08-20 09:47
海口从严整治房地产市场　已处罚17家企业 新浪新闻08-,432,0,08-20 09:45
房地产监管风潮燃起 30余城加入整治行列 腾讯房产08-2,422,0,08-20 09:42
扛不住了,243,0,08-20 09:36
希望中央不要保护损害人民利益的集团，一旦查到追究到,967,1,08-19 17:46
房租暴涨正在惩罚不买房的人？一句谬论，昨夜监管部门,1320,1,08-19 17:33
别了，高房租！北京出手严查哄抬租金扰乱市场行为！ ,950,1,08-19 17:29
下周看涨,412,0,08-19 15:57
独角兽，绿色通道，现在呵呵！,425,0,08-19 11:50
别想多了！其实真正的底部区域在这里[想一下]月k线已,774,0,08-18 17:17
为什么股灾这样暴跌，对连续下跌的股票不进行特停？,361,0,08-18 14:35
有人知道上证50ETF期权吗,753,2,08-18 14:34
股市该这样搞:1，新股的发行上市，首日取消涨跌限制，,498,0,08-18 13:47
看看股指期货空头尺寸，和新加坡A50指数，就知道了，,1800,0,08-18 12:28
今天股民给李大霄一个底，2641.74这个点位你能翻译出,435,0,08-18 11:10
ipo都还没停，哪里来的底，等暂停ipo以后再跌个10%左,341,0,08-18 09:15
那年 50 暴涨！没一个散户赚钱！那年50暴跌！每一个散,639,1,08-17 23:18
难辞其咎！三年来搞成这样？,1305,3,08-17 23:11
国家队既是裁判又是运动员还要耍流氓现在又在刷无赖 !,750,1,08-17 23:07
本人对股市的想法:1，新股的发行上市，首日取消涨跌限,483,0,08-17 22:39
茅台跌破500就到底啦,523,0,08-17 15:41
想不明白为什么涨一天跌七天呢？真的不适合我们在里面,329,0,08-17 15:27
全国股民喜迎大A创新低,618,1,08-17 15:27
对于中国股市、啥也不用说，送它一个字就够了~操！,438,1,08-17 15:16
明天顺势下跌,278,0,08-17 15:04
是谁做客中国股市股指期货，上证50 国家队,386,0,08-17 15:04
准备上山打游击。,262,0,08-17 15:00
把K线反转过来看 还是不错的心情,243,0,08-17 14:55
看看小美，再看大A！我无语啊！,594,1,08-17 14:49
垃圾50   砸盘50,284,0,08-17 14:48
空头不狗狠,333,0,08-17 14:46
按在地上，一顿痛打,327,0,08-17 14:40
新低何时到！,290,0,08-17 14:31
可怜的中国股民,317,0,08-17 14:30
跳水冠军是中国的强行！,325,0,08-17 14:28
美股跌，你大跌，美股涨，你也跌！,198,0,08-17 14:27
还在发新股，股票都跌成狗了，为何不追责？？？,1572,4,08-17 14:19
那一年的50指数暴涨！没一个散户赚钱！那一年的50指数,274,0,08-17 14:11
我们奴隶起来可以搬倒50吗,277,0,08-17 14:06
这50指数真的不祥的,275,0,08-17 14:05
大盘就是被这些国之头的大公司害死,192,0,08-17 13:54
快新低,242,0,08-17 13:42
韭菜测评！请选择,338,0,08-17 13:33
万恶的50！一高开就做空,294,0,08-17 13:26
"这就是股指期货威力助涨助跌顺势如为,敢去逆势加仓找",530,1,08-17 13:25
六连跌,188,0,08-17 13:14
我坚信今天一定收阳,753,1,08-17 12:12
维权事件开始了 老板花费百万元，买了300箱茅台！快喝,570,0,08-17 12:11
垃圾50   垃圾50,246,0,08-17 11:57
生物医药，酒类，家电巨头，地产，卷商，银行，超跌股,167,0,08-17 11:49
扶不起的阿斗,301,1,08-17 11:27
死50在那里扛着，就是50害了股市。,251,0,08-17 11:24
砸绿了吧，你就耍流氓，撑了,258,0,08-17 11:15
老妖！周末还发新股赚钱吗？,1048,4,08-17 11:09
坑人无数啊！,229,0,08-17 10:48
今天坑人无数啊，从形式大好到绿油油一片，你功不可没,211,0,08-17 10:28
都在翻绿呢，又开始连锁恐慌了，,268,0,08-17 10:28
集体拉稀呢！就这个怂样！来个有能力有魄力的,330,0,08-17 10:25
跌吧！跌吧！自残的够了就自淫了吧！,232,0,08-17 10:07
去年割家队拉了一年的上证50，现在又跌到哪了？,266,0,08-17 10:05
融资仓位太重，是拖累股市的最后一根稻草,4274,6,08-09 19:58
离离原上草，一天一收割！韭菜割不尽，利好吹又生！,748,0,08-07 10:32
拉几个指标股护盘，维持繁荣假象！帮助零成本的大小非,7912,35,07-05 08:23
加大处罚力度 百余家中介被关停业 司法机关参与整治 ,409,0,08-17 10:05
无耻之徒，不放过一次出货机会。50不死，永远不到底。,468,0,08-17 10:01
原来高开是骗人的,401,0,08-17 09:49
太他妈的坑爹了,157,0,08-17 09:46
严查违规销售 “阴阳合同”“黑中介”成为重点 综合各,299,0,08-17 08:34
希望未来对白酒医药强监管，每个角落调查都不放过 会,327,0,08-17 08:32
房地产股不要去碰，住建部治理会查出很多猫腻 房地产,474,0,08-17 07:57
欧美股市又大涨呢！明天找什么理由呢？[大便][大便][,352,0,08-16 22:51
连跌一周，股灾正式开始！清仓走人。,370,0,08-16 15:03
低开回升假阳线，成交量低迷，继续看空[空仓],235,0,08-16 14:59
多头今天都攻了两波，再攻一波呀！,143,0,08-16 14:56
什么情况，还有这么多人建仓,330,0,08-16 14:44
尾盘开始砸，更狠，癌症晚期,258,0,08-16 14:34
害人的50,276,0,08-16 14:32
害人的50,218,0,08-16 14:32
牛掰了，钝刀子割肉,722,1,08-16 14:31
房价伤中国人伤得太深了，房价的泛滥就是炒作，由市场,435,0,08-16 13:59
还得50,235,0,08-16 13:58
拉什么不好，拉证券，日了狗！！！,728,1,08-16 13:45
今天 上证50 可能要收上2480点。,344,0,08-16 13:33
"上去后卖给,上去后卖给,上去后卖给,只有一小时行情真",293,1,08-16 13:31
创新低后目前2200只股票下跌，比昨天3200只下跌少，加,297,0,08-16 13:14
房租，房子，或将成压垮年轻人的第一根稻草 那些满怀,329,0,08-16 13:09
今天的指数就靠你修正了,197,0,08-16 13:08
哈哈,295,0,08-16 13:03
今天创新低，两种选择：开始反转；开始股灾；下午就能,358,0,08-16 11:50
大小非减持造富是中国股市下跌第一动力,378,0,08-16 11:24
权重股不能入，慢慢熊路，来一个套一个,308,0,08-16 11:23
大盘又要玩完的走势,445,0,08-16 11:07
好吓人啊,469,0,08-16 11:06
刚看股评，湘财证券分析师预计上证要调到2400点，还30,2287,4,08-16 11:00
大家举手表决一下，有多少人愿意涨上去，反正我也是愿,375,0,08-16 10:53
感谢主力上午给逃命机会……[鼓掌],452,0,08-16 10:47
威武50，我是来看表演的,332,0,08-16 10:45
控制上证50，成功把大盘砸到了新低,558,1,08-16 10:09
指数就靠你了,621,0,08-16 10:05
又造假了,437,0,08-16 10:05
"现在比以往不同了,现在炒股见不秒时直接跌停卖出,以往",402,0,08-16 10:00
现在就剩上证50还没探新低了！快了，必须探新低！[大,450,0,08-16 09:56
美股大涨A股大跌，美股大跌A股暴跌，开盘一片惨绿！癌,371,1,08-16 09:49
国家队做股指期货空单，又开始大幅盈利了,421,0,08-16 09:36
苹果手机卖的越好，A股好像跌的越欢？,319,0,08-16 08:44
苏州：九部门联合发文整治房地产市场秩序专项行动 08-,750,0,08-16 07:23
说好的增持呢[兴奋][兴奋][兴奋]老板您好,261,0,08-16 06:10
外国资本买入a股和那个m开头的基金，和刚入股市的小散,744,2,08-15 23:50
什么时候茅台200快大家再去抄底,287,0,08-15 22:07
茅台砸盘呀，2000还是2200见底？？？,685,1,08-15 21:21
昨天小边冒了个泡，傻了吧;今天老蔡又出来胡咧咧,412,0,08-15 20:18
50领跌，国家队也不出手，让散户们怎么相信价值投资？,1291,4,08-15 19:46
相信价值？世界哪个国家股市有价值,361,0,08-15 19:44
A股的历史大底都是外资抄的,399,0,08-15 15:29
一个腐败的市场也叫价估值投资，呵呵呵呵,477,1,08-15 15:15
明天若击穿2691点应没什么问题？也许是近期最佳买点？,288,0,08-15 15:12
和谁有过节就叫谁去炒股,182,0,08-15 15:07
上证50全绿，打死这些喊价值投资的大脸。,389,1,08-15 15:03
污0不到，大盘永远涨不起来。,221,0,08-15 15:01
这是为什么啊,200,0,08-15 14:50
风险可控？不是用嘴吹的！,470,1,08-15 14:47
上证50离底部还有20%的跌幅,1128,4,08-15 14:47
大白马现在价格还是高高在上，现在的价格还得腰斩才行,659,0,08-15 14:43
真不要脸,506,0,08-15 14:43
50今天砸盘何意?,501,1,08-15 14:42
国之大器[不说了],432,0,08-15 14:33
看看谁在砸盘,397,0,08-15 14:31
尾盘夜盘勾引，明天周四呢,399,0,08-15 14:29
丢人现眼的玩意，就1家红的[不赞][不赞],428,0,08-15 14:27
天天就这样下跌，恐慌就这样蔓延，想救的时候还来得及,1195,4,08-15 14:19
漂亮50撑起1400多只股票的股市,168,0,08-15 14:12
没人接,269,0,08-15 14:12
50跌破2000点后大盘才有像样的反弹,265,0,08-15 14:07
漂亮50，哇塞,328,0,08-15 14:05
妈的，这要是招谁惹谁啦，这样搞。,222,0,08-15 14:05
没国气,629,2,08-15 14:01
小“头尖顶”。,380,1,08-15 13:59
今天的反弹   13点20分左右      注意观察,363,1,08-15 13:52
镇远护卫车队正在护卫着大量资金赶往股市救市，大家踏,251,0,08-15 13:30
开始企稳了,277,0,08-15 13:17
现在可以买股票了，已经快要突破2700了。。。。估计会,278,0,08-15 13:17
所谓否极泰来。中国股市规律，熊市不跌透，牛市来不了,1272,0,08-14 11:27
上证50就是搅屎棍,2794,26,08-12 15:51
国家队给大家机会抄底了！估计又没什么人敢抄！,765,2,08-15 13:21
国家队给机会抄底啦！,450,0,08-15 12:54
股汇双杀!当果这次估计玩完!,271,0,08-15 12:30
重庆市公安局介入楼市整顿 炒房或上升至犯罪行为 08-1,678,0,08-15 11:42
粤港澳概念股周三能继续爆发吗？ 导语欢迎来到股吧讨,257,0,08-15 11:41
数了数3000多只下跌，指数微调，信心在不断巩固和恢复,290,0,08-15 11:27
你敢开T+0吗,139,0,08-15 11:27
今天砖家肯定收市股评：指数微调、外围资金抢夺筹码大,347,0,08-15 11:22
彻底死心吧！消户关电脑断网………,249,0,08-15 11:16
这下牛了底部没形成到形成了头肩顶,203,0,08-15 10:56
国家队呢？,368,1,08-15 10:54
砸保险银行,278,0,08-15 10:50
再跌就要更下一层楼了,157,0,08-15 10:50
垃圾中的极品,230,0,08-15 10:41
厉害了，跳水冠军，大A股,195,0,08-15 10:41
要不要这么弱啊！故意洗盘，是吧？天天阴跌,146,0,08-15 10:38
没希望的股市50都护不起盘了[大笑][大笑][大笑],376,1,08-15 10:35
新加坡50继续砸盘,223,0,08-15 10:31
香港股市砸出新低,403,1,08-15 10:20
炒底专业户:不见新低绝不进,206,0,08-15 10:19
最坑人的上证50成份股！。,129,0,08-15 10:10
有能力防止股市大涨大跌已经验证了，那么咱能防止股市,479,1,08-15 10:09
跳水冠军，大A股,218,0,08-15 10:06
新加坡50跳水了,383,0,08-15 09:55
搞毛线，天天这个鸟样，美股大涨，中股来熊样，真它娘,233,0,08-15 09:53
周期跌都没有到位，怎么会涨,189,0,08-15 09:48
看了吧！涨一天跌N天，这就是三年来股市的真实写照，,189,0,08-15 09:43
玛丽隔壁  又领跌,135,0,08-15 09:43
付不起的阿斗,341,0,08-15 09:40
搅屎棍是为股指期货服务滴,985,2,08-15 09:34
股民质疑，黄晓明不认识高勇，怎么会出借账户，留有资,524,0,08-15 02:18
股民呼吁黄晓明，若真的对高勇利用自己账户进行的操作,421,0,08-15 01:44
股民：黄教主你好，如果你信任我，你也出借一下账户借,252,0,08-15 01:31
亚太普涨、欧美普涨，我大A已经走出独立行情了，砖家,459,0,08-14 23:41
股民问一下黄晓明哥哥，股票账户银行卡要绑定本人身份,365,0,08-14 23:25
现在每月新增多少资金进入股市都不够每月解禁股塞牙缝,581,0,08-14 22:36
力度空前！重庆市公安介入楼市整顿 九类行为或将移交,565,0,08-14 20:06
天天2000多只股票下跌，真垃圾！,466,1,08-14 15:39
装逼50,329,0,08-14 15:14
奇怪，怎么还不暴跌呢？,627,1,08-14 14:39
三年来就是个垃圾场,260,0,08-14 14:23
600592明日大阳,225,0,08-14 14:08
正常波动，无需关注！,170,0,08-14 14:05
拜拜了，中国股市走人了,261,0,08-14 14:01
污0要破800点。大盘才有希望起死回生。,237,0,08-14 13:44
傻逼50  应该开辟一个单独市场 让基金们自己玩,256,0,08-14 13:39
上证50一堆大烂臭，有好就怪了,246,0,08-14 11:35
还加班开会稳定股市，就这样稳定啊？假大空没措施没机,316,0,08-14 11:13
又开始砸盘，什么怪胎啊，还不稳定投资者信心,333,0,08-14 10:49
这次很弱,211,0,08-14 10:04
上证50绿的时候大盘能好到哪天天控制50控制大盘,198,0,08-14 09:47
10个交易日里8天下跌，唉！大狗熊继续前进，加油！,261,0,08-14 09:47
对于深市来说上证50并不友好,306,0,08-13 14:51
500手IF期指空头合约，见光死，,453,0,08-13 14:15
早说过50就是搅屎棍,328,0,08-13 13:02
杀创业板杀了这么多天开始杀上证，反正就是来回的杀！,850,1,08-13 11:46
杀他个干干净净,241,0,08-13 11:30
真的是把散户当对手盘在干，威武,408,0,08-13 11:20
不拉一下，新韭菜怎么敢进场呢。拉一下吧国家队,441,0,08-13 11:16
告别大A重新做人。,296,0,08-13 11:09
又3000只股票下跌了，癌股太威武了！,381,0,08-13 11:07
养老金进来一定要破2000点，大家不要相信要涨,405,0,08-13 11:06
都在积极维护经济稳定提振投资者信心而股市却在砸盘！,388,0,08-13 11:05
现在发现上涨，下跌都有增加，要千股的时候开始了，绿,422,1,08-13 11:04
一定要砸盘么?,338,0,08-13 11:01
%7的来临，,604,0,08-13 10:59
土耳其里拉继续大跌，可怕,428,0,08-13 10:55
故意的,296,0,08-13 10:53
这是砸盘,288,0,08-13 10:52
快关门算了,294,0,08-13 10:48
艹,188,0,08-13 10:38
两千点不是梦,201,0,08-13 10:31
"为了防美股崩盘，先自杀后，再通杀,",264,0,08-13 10:19
大烂臭！,238,0,08-13 10:07
操，崩盘了，什么世道,625,1,08-13 10:05
稳住,602,0,08-13 10:02
又小3000只股票在下跌，我勒个去！,628,0,08-13 09:24
李大霄你慢慢的吹你那个2691的底吧？见底如何？就一定,855,3,08-12 15:51
没有英特尔芯片照样成功，全新国产自研E级超算完成研,570,0,08-09 12:48
选贤任能，振兴中华！,764,1,08-08 18:05
刚说股市要稳住了，IPO加大又给脸色看了，搞吧！,1145,2,08-13 10:42
上证50，毒瘤,442,0,08-13 09:52
董云庭：集成电路产业发展初期必须由政府主导 08-12 1,1055,0,08-13 09:22
重磅科技政策需要落实实处，国务院成立科技领 导小组,650,0,08-13 09:09
炒房客 “这辈子最失败的生意就是去厦门炒房” 厦门楼,1220,0,08-13 08:57
售楼处营销人员 “开发商是在亏钱卖房” 8月8日，北青,1130,0,08-13 08:56
厦门楼市众生相：炒房客被套牢 房产中介改卖保险 08-1,871,0,08-13 08:54
50涨吸血！50跌拖累！一个双面做空的指数竟然能存在！,4215,41,08-12 15:14
经济观察报记者获悉，这一轮“处僵治困”的重点督办行,336,0,08-12 13:53
现在的年轻人很少喝白酒，又有三公消费，制酒辛苦需要,335,0,08-12 12:17
北京部分银行房贷利率首套上浮30% 二套上浮50% 工行和,1168,0,08-12 12:15
房价从2.5万跌到1.3万，很多人疯狂降价甩卖房，一套都,696,0,08-12 12:12
你不要以为你是女的我就不追究你。,262,0,08-12 10:54
民众也认为贵州茅台不是国酒，只是他们在电视广告中用,464,0,08-11 13:55
贵州茅台是不是国酒再起争议 两度申请商标被驳后起诉 ,350,0,08-11 13:51
国家商标主管部门：使用“国酒茅台”存在欺骗性或误导,307,0,08-11 13:44
国家商标主管部门：贵州茅台国酒商标不予注册 财经pai,681,0,08-11 13:38
郑州、武汉、长沙促销活动被叫停雇人购买茅台酒后再谋,410,0,08-11 13:26
郑州茅台促销被叫停，雇人买酒，通过1399元购买一瓶茅,400,0,08-11 13:18
贵州茅台镇副镇长王昭涉嫌严重违纪违法接受调查 新浪,307,0,08-11 13:11
商评委：“国酒茅台”商标违反了《含“中国”及首字为,298,0,08-11 09:10
“国酒”二字不是荣誉，而是代表产品的质量，“国酒”,897,0,08-11 09:08
茅台：两度申请商标被驳后起诉商评委 近两年，“国酒,337,0,08-11 09:06
商评委：“国酒”两个字使用在商标中带有欺骗性 2018,294,0,08-11 09:05
