操控指数啊,5055,0,10-12 15:46
A股今日再现“V”型反转，早盘指数续创调整以来新低，,5361,0,10-12 15:06
看这样的拉法，下周铁定破2331了,4973,0,10-12 14:41
上证50赤裸裸,5052,0,10-12 14:40
王八盘必崩盘,4869,0,10-12 14:39
护盘？？可笑！不跌爽了，社保基金怎么进！！进去赔钱,9739,2,10-12 14:19
差不多了，现在就是1～ 2天行情，开仓。,4820,0,10-12 14:09
银行 白酒 基建 几十年了 过去的支柱 未来的希望 A股,5101,0,10-12 14:04
最后还是50唱独角戏,4917,0,10-12 14:00
还不救市！股灾了！,9171,2,10-12 13:57
2020年6月1日前，002875安奈儿都是准次新股，投资、投,5088,0,10-12 13:56
冲啊！给我顶住，顶住五两大烟土-五块大洋。,4910,0,10-12 13:43
上证50快挺住，我支持你,4398,0,10-12 13:36
为什么不去买上证50，不就跟着涨了呢,5001,0,10-12 13:35
又在拉NM什么！,8595,1,10-12 13:28
50至少还有20%的空间可以跌,8852,2,10-12 13:14
好啊，50加油啊！中国的希望都寄托在你们身上了。,8456,1,10-12 13:14
50不死，做空不止,8944,5,10-12 13:08
继续拉50，说明还在半山腰上，小散管住手,9871,3,10-12 12:56
昨天2点50-开始上证50的定投第一波,4983,0,10-12 12:27
50应该走一个破底式，才能更真实,4823,0,10-12 12:17
上证50护盘真出力，牛逼就把平安茅台拉涨停。,8685,1,10-12 12:12
大盘底在何处？,5093,0,10-12 12:12
"致:A股亲爱的散户朋友们，大盘至年初开始已经缩水30%,",5118,0,10-12 12:06
如果能再跌两周 10年内8888点不是梦……,4646,0,10-12 12:03
最起码国家队在勇敢的做多，其它的人呢？？[为什么][,9385,2,10-12 12:00
下午又给吐回去！！！,4909,0,10-12 12:00
离底部就一步之遥，可以买了,4985,0,10-12 11:56
买买买,4966,0,10-12 11:55
现在开始比赛，预备……,4836,0,10-12 11:49
有病！,4611,0,10-12 11:49
你都在说国家队拉50护盘，说放开由市场决定。一群散户,4711,0,10-12 11:49
券商急呼：降税降税降税，让我们这个冬天活下去。,4931,0,10-12 11:42
真不要脸，还拉这种垃圾,4910,0,10-12 11:40
证券时报社评：廓清迷雾恢复信心 积极作为稳定股市,4620,0,10-12 11:35
50大概神经病吧。,8845,1,10-12 11:30
国家队在使力只不过是做空要比做多容易罢了,4902,0,10-12 11:26
今晚千万别发新股稳定一下恐慌的心理，暂缓一段,4871,0,10-12 11:25
出工不出力！,4641,0,10-12 11:18
大崩盘太可怕，没有一点防控机制！,4811,0,10-12 10:58
茅台是风向标。,4724,0,10-12 10:57
要护盘就一鼓作气，拉一下退一步，禍害大盘！,4643,0,10-12 10:57
逆大势投资是最愚蠢的行为！你以为你骂骂上证50，你的,3916,0,10-12 10:54
祸害50,4696,0,10-12 10:48
没娘的孩啊,4618,0,10-12 10:44
外国银行现在都债务缠身，流动性紧缺，坏帐增加，难道,4670,0,10-12 10:36
在当前这种情况下拉抬50指数引诱做多，这不是坑害投资,7906,1,10-12 10:34
坚信社会主义优越性[鼓掌][鼓掌]红色是我的颜色，股市,3686,0,10-12 10:34
支持你飙吧,4531,0,10-12 10:32
今天周五50肯定大红,4630,0,10-12 10:28
失真的50,4567,0,10-12 10:24
全靠你了  我操,4403,0,10-12 10:22
太牛了，全球股市就你红,4414,0,10-12 10:22
失真的指数,4586,0,10-12 10:20
强拉,4481,0,10-12 10:18
继续拉呀，只有大茅台了吧,4047,0,10-12 10:14
比赛割肉,4431,0,10-12 10:13
50指数赶紧上吧，追上上证综指，感觉整个大癌股只需要,4027,0,10-12 10:10
50是主心骨，所有资金都跟着50行事呢，涨起来,7904,1,10-12 10:05
新股,4064,0,10-12 09:59
崩盘上证50，将导致新股发不出去。所以，请顶住！,8070,2,10-12 09:58
有本事别啦50,3819,0,10-12 09:58
买50的兄弟们 你们应该换着买黄金股,4015,0,10-12 08:40
金价涨的不要不要的,4078,0,10-12 08:40
还以为50会护盘，,4239,0,10-12 07:09
把股市搞成这样[哭][哭]我去吃片药去！,4119,0,10-12 06:52
我可以板上钉钉的说：股市三年之内没啥希望！,3987,0,10-12 00:13
蔡老师今晚又出来忽悠了：明天买买买,8077,2,10-11 23:09
[图片],3977,0,10-11 18:32
中石油迎来了春天！！！石油开采板块，将带领股民朋友,6796,1,10-11 17:48
怎么不提毒脚兽，CDR了？,7721,1,10-11 17:28
能力诀定一切，主板创业板新三板垃圾遍地做假遍地，如,3786,0,10-11 16:08
明天收小阳，晚上好IPO，踏踏实实吧！一直循环到新股,3784,0,10-11 15:54
大小非减持造富成为中国股市笫一大公害,3639,0,10-11 15:46
厉害50不死,3845,0,10-11 15:08
50缴械投降了,3866,0,10-11 15:03
国家队也没有用。。。。,3850,0,10-11 15:03
中国股市太吓人太恐怖了,8219,1,10-11 14:57
上证50跌4%！不得了！真的不得了！,6947,2,10-11 14:50
就是不卖，筹码就是不给你，就算一分钱也拿着，你能咋,3859,0,10-11 14:43
熊霸天下，,3810,0,10-11 14:34
他认为，现在中国资本市场没有系统性风险。,7640,1,10-11 14:30
明天没反弹?,3841,0,10-11 14:25
这个时候还护盘干什么。顺势跌才是健康股市,7943,2,10-11 14:18
50全军覆没？,8148,2,10-11 14:13
"还没有千股跌停拿着巴,专家说没有千股跌停不见底?",7703,1,10-11 14:12
收盘翻红,3760,0,10-11 14:05
某队进来了，是救市还是抄底？,3700,0,10-11 13:47
大小非减持造富成为中国股市一大公害,7663,1,10-11 13:45
牛50假指数，居然无创新低！,3740,0,10-11 13:44
跌这么点就要开啦了？,3769,0,10-11 13:41
美股大跌是因为美股高位呆很久了，该调整了，Ａ股干嘛,4487,0,10-11 13:32
狗屎50只是开始[大笑][大笑][大笑],3760,0,10-11 13:29
看我50大显神威。,7618,4,10-11 13:12
现在还是慢牛格局，不就才跌三年吗？牛市爆发前必须先,7432,1,10-11 13:09
大盘跌停了，多年未见！,3763,0,10-11 13:08
早期若暂停，少发新股，健全退市制也不至目前如此与外,3794,0,10-11 13:00
看鸡能抱团吗,3619,0,10-11 12:10
完了。谁来拯救我,3721,0,10-11 11:48
还以为50指数能护盘？,3664,0,10-11 11:44
50越反弹其他跌越多，现应该先做活小盘股，下午收盘前,3766,0,10-11 11:38
上证50才跌3点多，这泡沫什么时候才能去的掉。,3747,0,10-11 11:34
溜溜了，跌下来了,3721,0,10-11 11:18
上证5o还没跌100点不要恐慌，很平稳微调,3727,0,10-11 11:18
你倒是没跌多少，也就把过节前拉的跌回去了，可其它股,3730,0,10-11 11:14
上证50涨幅过大，泡沫还未出清，管住手。,3800,0,10-11 11:12
---2502.50见大底！,3691,0,10-11 10:57
今天两破2638了，拭目以待,3534,0,10-11 10:54
这个s  b拉起来，最后害的还是老百姓,3500,0,10-11 10:31
可以理解主力机构们操纵指数做股指期货，他们极度看空,7186,19,10-11 10:29
西红柿番茄你还好吗？,3605,0,10-11 10:27
看看几瓶白酒 几桶油 几家银行 指数的半壁江山都在里,3286,19,10-11 10:25
病入膏肓的癌股，不是放一两天量就能结束市的。,3316,21,10-11 10:25
拉指数发新股抽血圈钱，个股却下跌最后爆仓不断，导致,4146,14,10-11 10:24
且看50自由任性表现。,3494,0,10-11 10:22
这波杀估值又是血肉横飞，一地鸡毛,3471,0,10-11 10:21
这些所谓的中流砥柱大盘股，,3420,0,10-11 10:03
这辈子做的最遗憾最后悔的一件事就是进去了中国A股市,3541,0,10-11 09:40
美股昨日暴跌，A股今天多会低开，,3606,0,10-11 07:32
上证50已三天未破20天与30天线，这里有支撑，,6618,2,10-11 07:32
根据技术分析，此底有强支撑[想一下],6414,2,10-11 07:27
上证50有资金砸盘，有资金护盘，,3439,0,10-11 07:17
上证50在死保2500，,6280,2,10-10 18:53
股指期货上串下跳，害人精,3559,0,10-10 14:47
别装了，阳痿吧,6305,1,10-10 14:29
没信心的中国股民,6464,3,10-10 14:06
50上涨才有牛市，中小创上涨股灾来临,6861,2,10-10 11:15
骂死你,3398,0,10-10 11:09
死了死了，被套了,3517,0,10-10 11:02
不要听所谓的砖家瞎逼忽悠五零是支撑不了的。,3557,0,10-10 10:43
今天不跌明天又是暴跌，不信等着瞧，该跌不跌必有妖孽,3426,0,10-10 10:36
还股民一个公平的市场，只有机构可做空，跌了3、4年了,6173,1,10-10 10:33
虚假的指数，害人不浅,3555,21,10-10 10:29
大跌了，快跑？！,6219,1,10-10 10:27
个股都跌成狗屎了，这就是股市的真面目！,5166,12,10-10 10:24
这是维稳走法？这是骗人走法。,3402,0,10-10 10:22
在骗人。,3446,0,10-10 10:16
这是弱市股市走法？这明明是强势股市走法？,3404,0,10-10 10:16
上证50本月不能有效破2500，,3760,0,10-10 10:05
又拉50，有用吗，现在的人聪明着呢，就这手段现在没什,3414,0,10-10 10:00
今天又听专家说慢牛格局三年来不改，我也知道现在是慢,3504,0,10-09 18:13
长裤   短裤  丁字裤  现在就剩下一片树叶了   加油,940,2,10-09 16:30
沪伦通马上要来了，又要给股市割个口子放血,3404,0,10-09 16:19
硬拉50把控指数，搞得市场没有活力，场外资金一直不敢,6018,10,10-09 16:19
上证50好样的，走自己的行情，让中小板没面吃。,3505,0,10-09 15:49
队,3422,0,10-09 15:01
又是50拉盘，有什么用吗？,6859,2,10-09 15:00
明日就是进场的好机会，大跌大买，不跌不买！,3764,0,10-09 15:00
有两年没说情侣表了,3425,0,10-09 14:47
情侣表,3461,0,10-09 14:45
完   了,3465,0,10-09 14:45
完  弹   了,3408,0,10-09 14:44
“断头铡刀”之后如何应对？,3676,0,10-09 14:19
50兴风作浪的妖精！[大笑],7617,14,10-09 14:18
不要面,3177,0,10-09 13:56
每次都这么干，恶心,3169,0,10-09 11:56
炒股十个人八个赔，这是操盘手考试题，你答对了以后就,8838,29,10-09 11:32
整天拖累大盘,3118,0,10-09 10:50
50指数上涨中国股市才会有牛市,3592,0,10-09 10:28
现在绿军气盛，来势凶凶，红军刚刚遭受了一次重创，要,3064,0,10-09 10:27
50指数就是一堆屎,3137,0,10-09 10:20
看我带头砸盘,3097,0,10-09 09:38
跑啊！,3093,0,10-09 09:33
危中有机，能力是个好东西，可惜你没有,3130,0,10-09 09:32
昨天是否只是跟随外围释放利空？今天是关键时刻，涨跌,3171,0,10-09 09:22
美股纳斯达克大跌0.67%，对应的创业板微跌4.07%。没事,3192,0,10-09 07:25
对50指数节后走势的看法,6169,6,10-09 05:17
诸位散户股友，晚上好！ 国庆7天长假，敝人值班3天，,7296,1,10-09 02:05
我们今天微调！,3154,0,10-08 20:35
血洗上证50,3082,0,10-08 18:38
节后跌5点开盘！,5358,1,10-08 18:36
看好那些外资，别让他们跑了！,3091,0,10-08 17:28
收评:大盘低开低走放量杀跌 探底模式再次开启,3209,0,10-08 16:56
"权重大幅杀跌,市场风格或迎切换",3518,0,10-08 16:49
大牛市来了，明天高开高走，大涨3%,6972,5,10-08 16:13
曾经的大蓝凑，如今波动很遛啊,2780,0,10-08 16:12
奇怪，今天50怎么不拉指数了,6250,1,10-08 15:28
涨的时候不涨跌的时候都大跌这垃圾股市,2755,0,10-08 15:11
又熔断一次,2806,0,10-08 15:09
瞧这出货的速度……,6918,4,10-08 14:51
加油，很快就熔断了[胜利][胜利],2845,0,10-08 14:37
一步到位，200点，,2777,0,10-08 14:26
股市你也太辣鸡了吧！,2793,0,10-08 14:25
每当50指数上涨几天后，后面肯定有大利空！这是规律！,2934,0,10-08 14:13
活该死了活该,2668,0,10-08 14:08
狗b指数，不要害人好么,2651,0,10-08 13:55
央行降准“超重磅”利好  A股节后开门红铁板钉钉！,8413,8,10-08 13:43
如何查阅上证50的成份股,6260,1,10-08 13:42
筑底，中级反弹酝酿中。,5395,1,10-08 13:30
外资做空癌股太容易了 节前一买 开盘就砸 四个点一买 ,2727,0,10-08 13:19
2519，这么强的支撑位，也是不堪一击。,6126,1,10-08 13:08
外资让锅加队尝尝小散的心情，好！,2475,0,10-08 11:24
今年跌破二千,5417,1,10-08 11:11
狂跌100点，流弊[大便],2439,0,10-08 11:06
韭菜割的爽呀,2469,0,10-08 10:56
这跟08的大盘差的很多呢！,2444,0,10-08 10:48
这不还没到4%呢吗？,2422,0,10-08 10:44
上证才跌这么一点,2445,0,10-08 10:41
今日宏达矿业继续涨停，总感觉资源股经过长期下跌，盘,2486,0,10-08 10:38
一天跌回去了[心碎],2411,0,10-08 10:37
B浪反弹完结了。,2381,0,10-08 10:28
完了,2393,0,10-08 09:59
人民不想摇白旗，但是呢，这明面上不是摆着嘛,2376,0,10-08 09:58
只有50上涨大盘才会有行情,5467,1,10-08 09:56
狗奴才，此时不拉，更待何时？,2389,0,10-08 09:49
无耻,2396,0,10-08 09:27
今天是空仓者买入的最后机会,2330,0,10-08 09:27
银监系统9月开罚单186张 2名村镇银行员工涉骗贷案被拘,3045,0,10-08 07:23
这可都是上证50指数,2490,0,10-07 14:56
当所有人都看跌的时候，股市肯定会涨，我相信下周一上,6016,2,10-07 14:43
降准也救不了你们,5188,1,10-07 14:42
银行股友大资金吃货，逢低买入银行股,2191,0,10-05 17:17
港股大跌！惨了！,2359,0,10-04 16:00
节后50继续攀升可能性很大,4505,0,10-04 09:20
买蓝筹弃垃圾,2056,0,10-02 23:53
中国首任证监会主席刘鸿儒先生：把维护广大投资者的利,2224,0,10-02 15:42
50股指强于其它股指会是今后几年的常态,2694,0,10-01 14:33
对50指数看法的两大派,4674,1,10-01 14:12
为何强拉50保指数？,5198,1,10-01 10:24
把美债全部清仓抛售掉！全部投入国防科技现代化研发，,1664,0,10-01 09:53
上证50九月缩量上涨十月会回踩5月线再拉起,1776,0,10-01 05:29
9月17号开始正好赶上大金融拉升为我创造了利润,1557,0,09-30 18:21
在5月线以下运行了7个月，9月重回5月线以上,1715,0,09-30 16:37
继续 拉漂亮50 几瓶白酒 几桶油 几家银行 亏损国企军,3449,1,09-30 15:28
腾讯启动战略升级：扎根消费互联网 拥抱产业互联网 09,1995,0,09-30 09:17
上证50下月需放量才能续涨,1726,0,09-30 05:02
还是少数股票有机会！,1687,0,09-29 20:35
节后是以50为首的蓝筹股行情,1742,0,09-29 17:58
低估值类蓝筹行情已启动,1683,0,09-29 17:34
银行股友大资金吸货,4068,1,09-29 16:53
大资金买银行类是50指数上涨的动力,1817,0,09-29 16:30
市场出现投资低估值风格,1546,0,09-29 16:30
牛起,2010,0,09-29 14:10
9月29日周评及后市走势展望,1504,0,09-29 13:50
有点像逼空,1698,0,09-29 00:05
强拉50，,4101,1,09-28 23:42
强拉50带大盘，,4033,1,09-28 22:19
各位股友晚上好！大家都清仓了结了吗？很好 ，绝大部,1819,0,09-28 22:05
上证50本周，本月并没放量，,1529,0,09-28 20:24
主力提前休假，减举,1355,0,09-28 14:25
建行、中行潜在风险敞口最大。,1365,0,09-28 14:24
这次要送证金、汇金到火葬场烧。,1240,0,09-28 14:06
再拉呀？,1138,0,09-28 14:04
为了保指数，用直升飞撒纸。,1060,0,09-28 14:00
各位散户股友晚上好!我是原不带长参谋，乐意为大家继,3868,2,09-28 13:56
大盘策略,1419,0,09-28 13:53
基本上确定牛市来了,5589,4,09-28 13:31
对了天天都要涨，节后大变脸！,1930,0,09-28 13:26
总感觉指数好假！,1195,0,09-28 13:11
下午调整为主，逢低吸纳！,1118,0,09-28 11:44
都在等银行股回调，到时候小盘股又要死一大片,1030,0,09-28 10:58
恶心恶心恶心,1017,0,09-28 10:58
这是印了多少呀,1120,0,09-28 10:57
加速拉，赶顶。发新股,1022,0,09-28 10:53
天天强拉50。。。,1679,0,09-28 10:45
今天银行 军工反包？,1710,0,09-28 10:44
5O辛苦了！！！[失望],3681,1,09-28 10:21
今日创新高，指日可待！,990,0,09-28 10:17
很快加息，加剧智障！利好茅台银行，快拉50吧,1168,1,09-28 08:18
上交所副总:拥抱技术，积极创新投教方式方法。以云计,1881,0,09-28 00:37
涨时暴拉50，跌时暴砸中小盘，可以啊[大笑],959,0,09-27 20:39
其实个股今天跌的很惨，股市真是万人坑害人精了。,3764,2,09-27 19:40
发改委联合十八部门：加快培育数字经济新兴就业机会，,2667,5,09-27 19:39
又一家房企加入打折行列 中粮宣布旗下16城66个楼盘优,1317,0,09-27 17:57
重磅科技 证监会:增强资本市场 支持数字经济创新创业,3506,2,09-27 16:53
发改委国开行拟投入1000亿发展数字经济 2018-09-27 中,3494,1,09-27 16:53
创业板迎来大利好！刚刚国务院“双创”升级版来了！这,3687,2,09-27 15:38
唯独上证50，沪深300，中证100，来护盘有用吗？,1357,0,09-27 15:09
净出近15亿[好逊][好逊][好逊]50狗集体趁势吐货套利，,3740,1,09-27 14:52
大盘将开启一轮新的牛市行情,1308,0,09-27 14:07
重磅美国对华食品药品作出反倾销和反补贴终裁 利空 09,3745,1,09-27 13:57
重磅美国对华食品药品作出双反终裁 利空 09-27 09:40 ,3476,1,09-27 13:54
重磅 国务院出台“双创”升级版意见：加大财税政策支,3574,1,09-27 13:48
支持创新型企业上市 “双创”升级版对A股影响会超预期,3548,1,09-27 13:47
重磅科技支持融资 发改委，证监会，工信部，科技部等1,3773,2,09-27 13:46
猜最后一小时会成深V？？,813,0,09-27 13:44
昨天涨个股普跌，今天利好你却跌个股还是普跌，你个假,904,0,09-27 13:34
死去吧,785,0,09-27 13:16
老乡别走，后面还有利好,3659,1,09-27 11:31
国务院“双创”升级版：支持双创企业未盈利上市、发企,1139,0,09-27 11:06
国务院发布“双创”升级意见：允许科技企业实行“同股,1672,0,09-27 11:00
这股市，50跟猴子似的上蹿下跳，50不是应该最稳。,624,0,09-27 10:44
冲啊50，股指中的战斗机！！！,809,0,09-27 10:43
抓住信息通信业发展机遇，推动数字经济全面发展 2018-,1437,0,09-27 10:42
多部门:强化数字人才培养 建数字经济创新创业孵化机构,896,0,09-27 10:36
"19部门发文 力挺发展数字经济促就业,督促各地落实到位",1013,0,09-27 10:30
真垃圾，个股普跌,666,0,09-27 10:10
快点拉抬吧，只能靠你了,663,0,09-27 10:08
今天交割日，看50如何装逼，被吊打,2412,1,09-27 10:01
重磅 多部门：增强资本市场支持数字经济创新创业能力 ,2178,1,09-27 09:37
重磅科技，远离蓝筹 ，传统行业不创新一定倒闭 发展改,2274,1,09-27 09:36
高层会谈科技强国，2018高层论坛丨闻库：大力发展数字,2316,1,09-27 09:36
重磅 发改委：未来五年投入千亿支持数字经济发展，支,2284,1,09-27 09:34
发改委等19部门：支持私募股权和创业投资基金投资数字,2276,1,09-27 09:34
重磅 工信部：4G用户达11.3亿 下一步将加快5G部署 腾,2473,1,09-27 09:34
国庆长假效应之下市场机会难把握,671,0,09-27 09:14
重科技，轻蓝筹，蓝筹积聚众多传统行业，不创新不是倒,858,0,09-27 07:19
安徽芜湖纪监部门启动幼儿园食品安全问题问责调查：8,827,0,09-27 07:17
大家清仓都清干净了吗？没有清干净抓紧时间 ，现在时,981,0,09-27 01:22
50下月崩跌！,4034,2,09-26 22:33
发改委发布关于发展数字经济稳定并扩大就业的指导意见,908,0,09-26 21:27
除了买权重股以及个别股票挣钱，买大多数股票尼玛居然,963,0,09-26 19:11
科技创新为“一带一路”建设注入新动力 当前，包括人,809,0,09-26 18:03
为什么都说明天跌 看k线图应该涨啊,689,0,09-26 17:23
创业板有望纳入MSCI因子 3600亿新资在路上 09-26 10:2,1246,0,09-26 16:36
重磅科技 百度与英特尔共建5G+AI实验室把握5G时代技术,1785,0,09-26 16:11
国家科技部与香港特区政府签署协议，加强内地与香港创,846,0,09-26 15:43
明天暴跌,2308,2,09-26 15:36
科技部:2020年我国将建成700个国家重点实验室 来源：,657,0,09-26 15:28
中央：科技创新成为“一带一路”国际合作新引擎 2018.,1022,0,09-26 15:16
第十七届西博会闭幕 投资项目签约7883亿元 每日经济新,659,0,09-26 14:57
失望，成交量没上千亿，继续表演,1980,0,09-26 14:39
重磅科技 19部委支持数字经济创新创业能力《意见》强,735,0,09-26 14:20
19部门联合发布，推动数字产业发展壮大，拓展就业新空,694,0,09-26 14:10
还没有清仓赶快清仓，越快越好。现在是加息gdp死（gdp,666,0,09-26 14:09
想没想过为什么银行股涨?银行股的估值真的是高吗？真,4689,1,09-26 14:04
9月26日股市早评：重磅利好，A股的最大赢家现身！,1046,0,09-26 13:55
不肯破位，下面没有空间，那好就用50来制造空间，再砸,2127,0,09-26 13:37
为什么指数涨幅这么大而个股涨幅却这么小？指数假的吧,1527,3,09-26 13:21
又拉50，还有别的事儿吗？,643,0,09-26 13:13
方向已明确，本周新行情将迎来了10月的开门红,3603,1,09-26 11:45
明天黑色日子在它的带领下，想一下，多可怕，股民的力,713,0,09-26 11:29
上证50涨得有点诡异,160,0,09-26 11:21
今早指数大涨，就是不知道哪来的底蕴，居然狂拉2桶油,2922,0,09-26 11:21
别停下，继续拉抬,716,0,09-26 11:21
你不需要追涨,2525,0,09-26 11:17
缩量反弹  上涨继续  今日认购短线,827,1,09-26 11:08
猜一猜 这个沟日的 今天会拉49点还是59点 明后天 平均,2071,0,09-26 11:04
谁再追高就是找死,526,0,09-26 11:01
半吊子又来了,826,2,09-26 11:00
又来QJ指数[不屑],665,0,09-26 10:28
全国股民都盼望上证50暴跌，成分股没有暴跌，大盘难言,202,0,09-26 10:07
商品房预售制度要退出舞台？是对开发商的严厉警告 张,802,0,09-26 10:01
住建部 ：9月多地严打房地产市场乱象 未来调控或继续,349,0,09-26 07:15
虔诚拜财神和股友tro 拥有纯属注定赔钱的散户性投机心,985,2,09-25 20:12
中秋小长假前的最后一个交易日,638,0,09-25 20:00
6次探底都未破2638点，底已被今日大阳确立了。 开启右,4930,28,09-25 19:25
只要枪在你手上，指鹿为马的事随便搞,723,0,09-25 16:00
又回到老路上了，只能新人换新颜了！,613,0,09-25 14:56
割完韭菜再跌,650,0,09-25 14:49
几天急拉涨人气，接着阴跌又套死一批！,3413,1,09-25 12:21
才拉了2天就那么着急的出货了？,2708,0,09-25 11:23
不能寄托上证50总是扮演护板角色，也可以是砸盘角色。,2628,0,09-25 11:15
继续拉吧，我的基金还有几个点解套了……拉指数救的不,1138,1,09-25 10:10
垃圾,82,0,09-25 10:04
中秋小长假前的最后一个交易日,752,0,09-25 09:32
沪深两市开盘近2600下跌，不到400家上涨，其他平盘。,655,0,09-25 09:30
易居研究院智库中心研究总监严跃进：广东此次对商品房,3295,0,09-25 09:04
下周上证大盘行情预报,3626,1,09-24 22:23
两桶油银行保险以及蓝筹股的机构们被套亏钱已经是板上,978,0,09-24 19:42
不把指数推高，周二继续下跌破位多尴尬,1319,1,09-24 19:42
又是二八行情？,2588,0,09-23 23:14
上海人工智能产业投资基金发起成立 目标规模100亿元，,782,0,09-23 13:36
保50弃大盘，假上证指数，深指比上证真实,1163,2,09-23 08:41
50已经没戏了，机构再拉也是白搭，抱团是上面给的暗示,1238,2,09-23 04:55
银保监会新闻发言人肖远企：多举措服务小微、民企，腾,1388,3,09-23 01:40
证监会：创新是引领发展的第一动力，是建设现代化经济,945,2,09-23 01:40
证监会将完善资本市场支持“四新”制度，加大对新技术,1371,0,09-22 23:07
证监会充分发挥资本市场优势，积极服务科技创新工作。,1178,0,09-22 23:07
证监会副主席阎庆民：发挥资本市场优势 加大对重点领,794,0,09-22 23:06
今晚不发IPO锦上添花就可能助推中国股市走向反转慢牛,2491,5,09-22 23:00
世界经济论坛执行董事艾德维：本届夏季达沃斯探讨第四,739,1,09-22 22:14
上交所将加强沪股通实时交易监控看穿式监管3季度开始,146,0,09-22 07:45
9月21日盘后分析,1058,0,09-21 22:40
不是说入富吗？？怎么半点消息都没有？,782,0,09-21 17:03
今天中长阳的最大意义！,1788,0,09-21 16:40
"有些散户就喜欢BB,前怕狼后怕虎的，吵个奇葩的股票",884,0,09-21 16:12
这周涨这么好，发5支新股。,1757,2,09-21 15:10
上次拼命做多50点货没出完 再做一波做双头出货里,829,0,09-21 15:07
有多少人跑赢大盘了？？？,822,0,09-21 14:58
一眨眼，日K线呈多重底形态了,852,0,09-21 14:51
好差200点哈哈，还要什么上证指数,906,0,09-21 14:33
其实不用拉的跌也会发新股的何必呢[大笑],1415,1,09-21 14:28
上证50只有涨才能让打新资金留在场内,1138,0,09-21 14:15
国家对只拉上证50,151,0,09-21 14:12
又是上证50，你们迟早都遭报应,2606,17,09-21 14:09
这个市场好多钱拉50,651,0,09-21 13:57
不要动不动骂人，发牢骚，你为什么不追蓝筹白马大盘股,2413,0,09-21 13:25
不是操纵不操纵，指数不指数，动动脑子有点经验就知道,2767,0,09-21 13:24
都不买，看能拉到3000不,668,0,09-21 13:22
今天大有一拉起来势不可挡的猥琐,656,0,09-21 13:22
做空的兄弟，不能一根筋，大势所趋，无论你们怎么唱空,2151,16,09-21 13:01
"就是一怪物,变态",130,0,09-21 12:15
艹泥马瞎啊！,926,0,09-21 12:13
都是它吗的三浪结构，能结束调整？,691,0,09-21 11:32
