IssuerName,CorporateRating,RatingAgency,Holder,Industry,Nature,YYRating,IssuerType,CreditAnalysis,PlatformImportance,PrincipalBusiness,PrincipalBusiness,GDP,Revenue,YYRatio,IssuerCity,ADLevel
南京铁路建设投资有限责任公司,AAA 展望:稳定,上海新世纪资信评估投资服务有限公司,南京市交通建设投资控股(集团)有限责任公司(持股98.72%),公路与铁路,地方国有企业,4/10,城投,南京市铁路项目投资建设的主要承担主体，主要负责南京地区重点高速铁路及相关配套项目投资建设。由于公司铁路建设未贡献收入，2017年公司实现营业收入15.39亿元，其中油品销售占比88.14%、融资租赁6.43%。公司资产由其他应收款、可供出售金融资产和在建工程构成，可供出售金融资产余额为104.41 亿元，主要系对京沪高铁及合宁铁路有限公司等投资，公司在建工程余额171.10亿元，主要系公司在建铁路建设项目的征地拆迁工程及相关配套建设成本等。截止18年3月末，公司刚性债务144.31亿元，资产负债率少于40%。历史上公司获得的政府置换债券资金较多。目前无存量债券。,主要平台,交通,交通,12820.4,1470,560.044%,江苏省-南京市,地市级
IssuerName,CorporateRating,RatingAgency,Holder,Industry,Nature,YYRating,IssuerType,CreditAnalysis,PlatformImportance,PrincipalBusiness,PrincipalBusiness,GDP,Revenue,YYRatio,IssuerCity,ADLevel
北京市基础设施投资有限公司,AAA 展望:稳定,中诚信证券评估有限公司,北京市国资委(持股100%),铁路运输,地方国有企业,2/10,城投,公司系北京市轨道交通投资主体，受政府支持力度较大，根据公司与北京市政府签订的协议，北京市政府将在2016年至2025年每年安排295亿元作为授权经营服务费拨付给公司。截至2019年3月末，公司在建和拟建项目充足，后续业务持续性较强。公司系A股上市公司京投发展第一大股东，但该部分股权市值不高目前未质押。截至2019年3月末公司货币资金充裕，对短期有息债务的覆盖倍数较高，债务压力不大（19年3月末63%），且公司受限资产较少，短期能提供的财务弹性较好。公司2017年及2018年经营现金流和投资现金流均为净流出，但公司的再融资能力强，投资回收前景较好，财务风险可控。,主要平台,基建,基建,30320,5785.9,126.2867%,北京市,省级
深圳市特区建设发展集团有限公司,AAA 展望:稳定,中诚信证券评估有限公司,深圳市国有资产监督管理委员会(持股100%),综合类行业,地方国有企业,3/10,城投,深圳市是中国互联网和创业氛围最浓厚的城市之一，对外包容度很高，经济充满活力，抗周期性强，18年GDP超2.4万亿。公司经多次资产划转后，资产规模大幅下降；但深圳市唯一的基础设施投融资平台定位更为明确，公司存货主要位于深圳科技园的办公楼和公寓，资产质量较好，债务负担尚可（19年3月末43.51%），整体资质很好。关注其他应收款的回收情况。,主要平台,综合,综合,24221.98,3538.4,23.8838%,广东省-深圳市,地市级
上海浦东发展(集团)有限公司,AAA 展望:稳定,上海新世纪资信评估投资服务有限公司,上海市浦东新区国有资产监督管理委员会(持股100%),建筑与工程,地方国有企业,3/10,城投,浦东新区18年GDP破万亿，一般预算收入过千亿。公司系上海市浦东新区的基础设施建设主体，区域地位重要，受地方政府支持力度较大。公司收入主要来自基础设施建设、商业和房地产，其中基建业务具有较好的持续性。公司目前杠杆率不高（18年9月末47%），短期流动性也较为充裕，整体债务偿付能力较强。,主要平台,综合,综合,10460.09,1066.2,116.9437%,上海市-浦东新区,区县级
